{
  "formatVersion": 1,
  "family": "packetcable",
  "edition": "PKT-SP-PROV1.5-C01-191120 + PKT-SP-EUE-PROV-C01-140314",
  "sourceSha256": "755566e2af6bd0324c8634b7d2ef79da10aa7ae1e898d3d373c587bd596b47bd",
  "definitions": [
    {"path": [11], "name": "Snmp11", "codec": "oid", "lengthMin": 0, "lengthMax": 0, "lengthBytes": 1, "supportedVersion": "1", "maxInstances": -1, "description": "PKT-SP-PROV1.5-C01-191120 section 9.1: BER SNMP VarBind. Type 11 has a one-byte length; use type 64 with a two-byte length for payloads exceeding 254 octets. Vendor-specific information belongs in type 43."},
    {"path": [38], "name": "SNMPv3NotificationReceiver", "codec": "byte_array", "lengthMin": 0, "lengthMax": 0, "lengthBytes": 1, "supportedVersion": "1", "maxInstances": -1, "description": "PKT-SP-PROV1.5-C01-191120 section 11: notification receiver container; repeated instances describe separate receivers. Required receiver address and notification type are device processing rules, not implied by template presence."},
    {"path": [38, 1], "name": "SNMPv3NRIPv4Address", "codec": "byte_array_ipv4_address", "lengthMin": 4, "lengthMax": 4, "lengthBytes": 1, "supportedVersion": "1", "maxInstances": 1, "description": "PKT-SP-PROV1.5-C01-191120 section 11.1.1: Four-octet IPv4 notification receiver address, network byte order."},
    {"path": [38, 2], "name": "SNMPv3NRUdpPortNumber", "codec": "byte_array", "lengthMin": 2, "lengthMax": 2, "lengthBytes": 1, "supportedVersion": "1", "maxInstances": 1, "description": "PKT-SP-PROV1.5-C01-191120 section 11.1.2: Two-octet UDP port; default 162 when absent."},
    {"path": [38, 3], "name": "SNMPv3NRTrapType", "codec": "byte_array", "lengthMin": 2, "lengthMax": 2, "lengthBytes": 1, "supportedVersion": "1", "maxInstances": 1, "description": "PKT-SP-PROV1.5-C01-191120 section 11.1.3: Two-octet notification type: 1 SNMPv1 trap, 2 v2c trap, 3 v2c inform, 4 v3 trap, 5 v3 inform. Required when receiver is present."},
    {"path": [38, 4], "name": "SNMPv3NRTimeout", "codec": "byte_array", "lengthMin": 2, "lengthMax": 2, "lengthBytes": 1, "supportedVersion": "1", "maxInstances": 1, "description": "PKT-SP-PROV1.5-C01-191120 section 11.1.4: Two-octet timeout in milliseconds; default 15000 when absent."},
    {"path": [38, 5], "name": "SNMPv3NRRetries", "codec": "byte_array", "lengthMin": 2, "lengthMax": 2, "lengthBytes": 1, "supportedVersion": "1", "maxInstances": 1, "description": "PKT-SP-PROV1.5-C01-191120 section 11.1.5: Two-octet retry count; maximum value 255, default 3. Range is a device semantic constraint."},
    {"path": [38, 6], "name": "SNMPv3NRFilteringParameters", "codec": "oid_asn1_object6", "lengthMin": 0, "lengthMax": 0, "lengthBytes": 1, "supportedVersion": "1", "maxInstances": 1, "description": "PKT-SP-PROV1.5-C01-191120 section 11.1.6: ASN.1 universal OBJECT IDENTIFIER tag 6, BER length and encoded filter OID; default iso root when absent."},
    {"path": [38, 7], "name": "SNMPv3NRSecurityName", "codec": "string", "lengthMin": 0, "lengthMax": 0, "lengthBytes": 1, "supportedVersion": "1", "maxInstances": 1, "description": "PKT-SP-PROV1.5-C01-191120 section 11.1.7: SNMPv3 security name, used for notification types 4/5; absent name defaults to @mtaconfig. Provisioned keys and receiver security semantics are not validated by this registry."},
    {"path": [38, 8], "name": "SNMPv3NRIPv6Address", "codec": "byte_array_ipv6_address", "lengthMin": 16, "lengthMax": 16, "lengthBytes": 1, "supportedVersion": "3", "maxInstances": 1, "description": "PKT-SP-EUE-PROV-C01-140314 section 6.5: sixteen-byte IPv6 notification receiver address in network byte order. PacketCable 2.0 only; IPv6 mode uses this instead of 38.1."},
    {"path": [43], "name": "VendorSpecific", "codec": "byte_array", "lengthMin": 0, "lengthMax": 254, "lengthBytes": 1, "supportedVersion": "1", "maxInstances": -1, "description": "PKT-SP-PROV1.5-C01-191120 section 9.1 and PKT-SP-EUE-PROV-C01-140314 section 6.4.2: opaque vendor-specific payload, including vendor sub-TLV headers. PacketCable 2.0 specifies sub-option 8 as six ASCII OUI characters. Payload bytes are preserved; vendor semantics are not interpreted."},
    {"path": [64], "name": "Snmp64", "codec": "oid", "lengthMin": 0, "lengthMax": 0, "lengthBytes": 2, "supportedVersion": "1", "maxInstances": -1, "description": "PKT-SP-PROV1.5-C01-191120 section 9.1: BER SNMP VarBind. Type 11 has a one-byte length; use type 64 with a two-byte length for payloads exceeding 254 octets. Vendor-specific information belongs in type 43."},
    {"path": [254], "name": "TelephonyConfigFileBeginEnd", "codec": "integer", "lengthMin": 1, "lengthMax": 1, "lengthBytes": 1, "supportedVersion": "1", "maxInstances": -1, "description": "PKT-SP-PROV1.5-C01-191120 section 9.1; PKT-SP-EUE-PROV-C01-140314 section 6.4.2: standalone file begins with value 1 and ends with value 255. Not an embedded DOCSIS wrapper."}
  ]
}
